id,name,category_name,brand_name,characteristic_name,product_status,mass,design,accessories,launch_time,description,sale_price,price,ram,rom,color,attribute_values
6,Điện thoại iPhone 15 Pro 128GBb,Smartphone,Samsung,Gaming,100,221.0,Nguyên khối,Tai nghe sạc,2023,,44000000.00,45000000.00,8 GB,256 GB,Đen,"a, a, a, a, a, a, a, a, a"
15,Điện thoại iPhone 13 128GB,Smartphone,Apple,"Cao cấp, sang trọng",100,221.0,Nguyên khối,Tai nghe sạc,2023,apple thỏa mãn chờ đón ifan mắt iphone 13 ngoại hình thay đổi iphone 12 cấu hình mẽ đặc biệt pin trâu khả năng phim chụp ảnh ấn tượng hứa hẹn trải nghiệm thú vị phiên hiệu năng đột phá xử lý apple a15 bionic vi xử lý apple a15 gia tốc độ cpu 50 gpu đồ họa 30 đối thủ cạnh tranh phân khúc giúp iphone 13 thể hiện sức khả năng xử lý ấn tượng mượt tác vụ tiền nhiệm chipset thể hiện tốc độ cpu cải tiến 40 hiệu năng đồ họa nhảy vọt 80 tiết kiệm điện năng 15 sản xuất tiến trình 5 nm cải tiến a15 bionic xử lý hình ảnh isp giúp nâng chất ảnh chụp động nét nhiễu hình ảnh phụ cảm biến máy ảnh iphone 13 dung 256 gb lý tưởng nhu cầu lưu trữ cá nhân nội dung lo iphone hỗ trợ 5g đảm bảo tốc độ kết nối tải phim game trực tuyến chia sẻ liệu thiết siêu hỗ trợ smart data giúp động tốc độ tiết kiệm pin hoạt động đòi tốc độ iphone 13 chạy hệ hành io 15 giao diện thân thiện hỗ trợ năng giúp trải nghiệm nâng shareplay thể nhạc chia sẻ màn hình facetime,20500000.00,20900000.00,8 GB,256 GB,Đen,"OLED6.1""Super Retina XDR, iOS 15, 2 camera 12 MP, 12 MP, Apple A15 Bionic, 4 GB, 3240 mAh, 20 W, 5g"
15,Điện thoại iPhone 13 128GB,Smartphone,Apple,"Cao cấp, sang trọng",100,221.0,Nguyên khối,Tai nghe sạc,2023,apple thỏa mãn chờ đón ifan mắt iphone 13 ngoại hình thay đổi iphone 12 cấu hình mẽ đặc biệt pin trâu khả năng phim chụp ảnh ấn tượng hứa hẹn trải nghiệm thú vị phiên hiệu năng đột phá xử lý apple a15 bionic vi xử lý apple a15 gia tốc độ cpu 50 gpu đồ họa 30 đối thủ cạnh tranh phân khúc giúp iphone 13 thể hiện sức khả năng xử lý ấn tượng mượt tác vụ tiền nhiệm chipset thể hiện tốc độ cpu cải tiến 40 hiệu năng đồ họa nhảy vọt 80 tiết kiệm điện năng 15 sản xuất tiến trình 5 nm cải tiến a15 bionic xử lý hình ảnh isp giúp nâng chất ảnh chụp động nét nhiễu hình ảnh phụ cảm biến máy ảnh iphone 13 dung 256 gb lý tưởng nhu cầu lưu trữ cá nhân nội dung lo iphone hỗ trợ 5g đảm bảo tốc độ kết nối tải phim game trực tuyến chia sẻ liệu thiết siêu hỗ trợ smart data giúp động tốc độ tiết kiệm pin hoạt động đòi tốc độ iphone 13 chạy hệ hành io 15 giao diện thân thiện hỗ trợ năng giúp trải nghiệm nâng shareplay thể nhạc chia sẻ màn hình facetime,18500000.00,18900000.00,8 GB,128 GB,Đen,"OLED6.1""Super Retina XDR, iOS 15, 2 camera 12 MP, 12 MP, Apple A15 Bionic, 4 GB, 3240 mAh, 20 W, 5g"
16,Điện thoại Samsung Galaxy S24+ 5G 256GB,Smartphone,Samsung,"Cao cấp, sang trọng",100,221.0,Nguyên khối,Tai nghe sạc,2023,samsung mắt samsung galaxy s24 5g 256gb điện thoại đẳng kiện hàng diễn 1801 mỹ độc đáo sản phẩm nằm chip samsung đi kèm phát triển bổ sung năng thông minh tích hợp cường khả năng chụp ảnh camera thiết kế vuông màn hình mỏng đầu tiên thiết kế máy vẻ ngoại hình vuông vức mặt lưng phẳng nguyên phong phiên nhiên hãng thay đổi bốn góc hơi vuông samsung galaxy s23 tổng thể vuông vắn trọng cực kỳ bắt trend tiếc samsung sử dụng chất liệu titanium khung hãng galaxy s24 ultra áp dụng khung nhôm hẳn tệ nổi bật ấn tượng hãng thay mạ bóng hãng quyết định khung viền kiểu nhám nhẹ hiệu ứng ánh kim kiểu thiết kế điện thoại trở biệt diện dòng mặt lưng ấn tượng sử dụng chất liệu kính cường lực kiểu nhám mờ thẩm mỹ giúp đảm bảo độ bền rủi ro hư hỏng sử dụng hằng,24790000.00,25790000.00,8 GB,256 GB,Đen,"Dynamic AMOLED 2X6.7""Quad HD+ (2K+), Android 14, Chính 50 MP & Phụ 12 MP, 10 MP, 12 MP, Exynos 2400, 2 Nano SIM hoặc 2 eSIM hoặc 1 Nano SIM + 1 eSIMHỗ trợ 5G, 4900 mAh, 45 W, 4g"
17,Điện thoại iPhone 15 Plus 128GB,Smartphone,Apple,"Cao cấp, sang trọng",100,221.0,Nguyên khối,Tai nghe sạc,2023,,21900000.00,22900000.00,8 GB,256 GB,Xanh lá nhạt,"OLED6.7""Super Retina XDR, iOS 17, Chính 48 MP & Phụ 12 MP, 12 MP, Apple A16 Bionic, 6 GB, 128 GB, 1 Nano SIM & 1 eSIMHỗ trợ 5G, 4g"
18,Điện thoại iPhone 15 Pro 128GBb,Smartphone,Oppo,"Mỏng, nhẹ",100,221.0,Nguyên khối,Tai nghe sạc,2023,oppo reno11 5g tiếp tục hấp cảm hứng thành công độc đáo điện thoại nằm thiết kế thu hút cấu hình mẽ khả năng chụp ảnh ấn tượng đáp ứng loạt nhu cầu giải trí nhiếp ảnh công đòi hiệu năng nổi bật thiết kế cảm hứng thiên nhiên chắn reno11 5g ấn tượng đầu tiên phiên hai màu sắc độc đáo xanh lá nhạt xám mặt lưng xanh lá nhạt phủ lớp vân cảm hứng biển xanh hiệu ứng sắc lấp lánh sóng biển điện thoại nổi bật thu hút màu xám vẻ đẹp tinh tế tối giản phản ánh phong trọng lịch lãm đặc nổi bật điện thoại oppo cụm camera thiết kế hình dáng bầu dục độc đáo nhấn đặc biệt tổng thể thiết kế viền xung quanh camera chế tác tinh tế hài hòa trọng vẻ đẹp thẩm mỹ điện thoại trở thú vị hút,4000000.00,5000000.00,8 GB,256 GB,Đen,"AMOLED6.7""Full HD+, Android 14, Chính 50 MP & Phụ 32 MP, 8 MP, 32 MP, MediaTek Dimensity 7050 5G 8 nhân, 8 GB, 256 GB, 2 Nano SIMHỗ trợ 5G, 5g"
19,Điện thoại Samsung Galaxy S24 Ultra 5G 256GB ,Smartphone,Samsung,"Cao cấp, sang trọng",100,221.0,Nguyên khối,Tai nghe sạc,2023,samsung galaxy s24 ultra mẫu điện thoại mắt đầu 2024 sản phẩm tiếp tục kế thừa cải tiến hệ đặc biệt sử dụng chip snapdragon 8 gen 3 for galaxy camera 200 mp tích hợp năng thiết kế trọng sử dụng titanium thiết kế galaxy s24 ultra thể nâng nổi bật dòng điện thoại flagship samsung 2024 cạnh thay đổi kiến trái chiều hãng lười sản phẩm đem nguyên kiểu thiết kế cũ thay đổi chất liệu nhiên cầm nắm trải nghiệm thực tế hãng thay đổi hẳn chép y hệt galaxy s23 ultra hãng cố vốn khắc phục nhược điện thoại hoàn thiện ấn tượng đầu tiên cầm galaxy s24 ultra máy hãng bo cong màn hình mặt lưng phiên thay hình phẳng phiu mặt lưng màn hình giúp đồng thể 2024 samsung mẫu điện thoại ultra phẳng trở mặt lưng bốn góc điện thoại 90 độ samsung galaxy s23 ultra công kiểu thiết kế đẹp ấn tượng nhiên kích thước galaxy s24 ultra góc vuông vô tình hạn chế cấn túi quần cầm ngang điện thoại game khung viền samsung hệ tiền nhiệm bo cong nhẹ vị trí giao mặt lưng màn hình cầm cực kỳ cầm chặt dường cảm cấn tí tranh cãi nâng galaxy s24 ultra lẽ khung viền titanium hãng đạo nhái kiến kế thừa phát huy trải nghiệm thực tế viền titanium đẹp viền nhôm dòng điện thoại hiệu ứng ánh kim nhám nhẹ giúp cảm giác cầm thỏi titan nhiên viền titanium đánh giá độ bền kim thông giúp điện thoại bền bỉ tình huống vô tình rơi va đập chí hạn chế vết hằn xước tiếp xúc vật sắc nhọn,30900000.00,31900000.00,8 GB,256 GB,Đen,"Dynamic AMOLED 2X6.8""Quad HD+ (2K+), Android 14, Chính 200 MP & Phụ 50 MP, 12 MP, 10 MP, 12 MP, Snapdragon 8 Gen 3 for Galaxy, 12 GB, 5000, 45 W, 5g"
